{
  "interaction_id": "int_foundation_example_1",
  "state": "intent_received",
  "actor": {
    "actor_id": "https://agents.example.com/actors/planner"
  },
  "peer": {
    "actor_id": "https://tools.example.com/actors/repo-reader"
  },
  "capability_ref": "https://tools.example.com/capabilities/read-file",
  "intent_ref": "int_intent_1",
  "version": "0.1.0-draft",
  "created_at": "2026-04-11T09:00:00Z",
  "updated_at": "2026-04-11T09:00:02Z",
  "last_transition_at": "2026-04-11T09:00:02Z",
  "evidence_head": "sha256:7c2f9b3a8e5d1c4f6a8b7e9d2c1f3a6b8e0d4c7f2a9b5e1d6c8a3f0b7e2d9c4f1"
}
